{
  "document_id": "test_0506",
  "source_image_path": "held_out_temp_images/test_0506_clean.png",
  "page_number": 1,
  "confidence_threshold": 0.5442,
  "final_text": "The scud had banked over the moon, and it was now quite clear.",
  "words": [
    {
      "word_index": 0,
      "bounding_box": {
        "left": 40,
        "top": 45,
        "width": 40,
        "height": 17
      },
      "ocr_text": "The",
      "ocr_confidence": 93.0,
      "damage_status": "intact",
      "damage_fraction": 0.0,
      "reconstructed_text": null,
      "reconstruction_confidence": null,
      "uncertain": null,
      "final_text": "The",
      "provenance": "ocr"
    },
    {
      "word_index": 1,
      "bounding_box": {
        "left": 89,
        "top": 45,
        "width": 48,
        "height": 17
      },
      "ocr_text": "scud",
      "ocr_confidence": 91.0,
      "damage_status": "intact",
      "damage_fraction": 0.0,
      "reconstructed_text": null,
      "reconstruction_confidence": null,
      "uncertain": null,
      "final_text": "scud",
      "provenance": "ocr"
    },
    {
      "word_index": 2,
      "bounding_box": {
        "left": 146,
        "top": 45,
        "width": 37,
        "height": 17
      },
      "ocr_text": "had",
      "ocr_confidence": 96.0,
      "damage_status": "intact",
      "damage_fraction": 0.0,
      "reconstructed_text": null,
      "reconstruction_confidence": null,
      "uncertain": null,
      "final_text": "had",
      "provenance": "ocr"
    },
    {
      "word_index": 3,
      "bounding_box": {
        "left": 192,
        "top": 45,
        "width": 75,
        "height": 17
      },
      "ocr_text": "banked",
      "ocr_confidence": 96.0,
      "damage_status": "intact",
      "damage_fraction": 0.0,
      "reconstructed_text": null,
      "reconstruction_confidence": null,
      "uncertain": null,
      "final_text": "banked",
      "provenance": "ocr"
    },
    {
      "word_index": 4,
      "bounding_box": {
        "left": 276,
        "top": 49,
        "width": 45,
        "height": 13
      },
      "ocr_text": "over",
      "ocr_confidence": 96.0,
      "damage_status": "intact",
      "damage_fraction": 0.0,
      "reconstructed_text": null,
      "reconstruction_confidence": null,
      "uncertain": null,
      "final_text": "over",
      "provenance": "ocr"
    },
    {
      "word_index": 5,
      "bounding_box": {
        "left": 328,
        "top": 45,
        "width": 32,
        "height": 17
      },
      "ocr_text": "the",
      "ocr_confidence": 96.0,
      "damage_status": "intact",
      "damage_fraction": 0.0,
      "reconstructed_text": null,
      "reconstruction_confidence": null,
      "uncertain": null,
      "final_text": "the",
      "provenance": "ocr"
    },
    {
      "word_index": 6,
      "bounding_box": {
        "left": 369,
        "top": 49,
        "width": 63,
        "height": 16
      },
      "ocr_text": "moon,",
      "ocr_confidence": 96.0,
      "damage_status": "intact",
      "damage_fraction": 0.0,
      "reconstructed_text": null,
      "reconstruction_confidence": null,
      "uncertain": null,
      "final_text": "moon,",
      "provenance": "ocr"
    },
    {
      "word_index": 7,
      "bounding_box": {
        "left": 442,
        "top": 45,
        "width": 37,
        "height": 17
      },
      "ocr_text": "and",
      "ocr_confidence": 96.0,
      "damage_status": "intact",
      "damage_fraction": 0.0,
      "reconstructed_text": null,
      "reconstruction_confidence": null,
      "uncertain": null,
      "final_text": "and",
      "provenance": "ocr"
    },
    {
      "word_index": 8,
      "bounding_box": {
        "left": 489,
        "top": 45,
        "width": 9,
        "height": 17
      },
      "ocr_text": "it",
      "ocr_confidence": 96.0,
      "damage_status": "intact",
      "damage_fraction": 0.0,
      "reconstructed_text": null,
      "reconstruction_confidence": null,
      "uncertain": null,
      "final_text": "it",
      "provenance": "ocr"
    },
    {
      "word_index": 9,
      "bounding_box": {
        "left": 506,
        "top": 49,
        "width": 41,
        "height": 13
      },
      "ocr_text": "was",
      "ocr_confidence": 96.0,
      "damage_status": "intact",
      "damage_fraction": 0.0,
      "reconstructed_text": null,
      "reconstruction_confidence": null,
      "uncertain": null,
      "final_text": "was",
      "provenance": "ocr"
    },
    {
      "word_index": 10,
      "bounding_box": {
        "left": 556,
        "top": 49,
        "width": 42,
        "height": 13
      },
      "ocr_text": "now",
      "ocr_confidence": 96.0,
      "damage_status": "intact",
      "damage_fraction": 0.0,
      "reconstructed_text": null,
      "reconstruction_confidence": null,
      "uncertain": null,
      "final_text": "now",
      "provenance": "ocr"
    },
    {
      "word_index": 11,
      "bounding_box": {
        "left": 606,
        "top": 45,
        "width": 49,
        "height": 22
      },
      "ocr_text": "quite",
      "ocr_confidence": 96.0,
      "damage_status": "intact",
      "damage_fraction": 0.0,
      "reconstructed_text": null,
      "reconstruction_confidence": null,
      "uncertain": null,
      "final_text": "quite",
      "provenance": "ocr"
    },
    {
      "word_index": 12,
      "bounding_box": {
        "left": 664,
        "top": 45,
        "width": 50,
        "height": 17
      },
      "ocr_text": null,
      "ocr_confidence": null,
      "damage_status": "missing",
      "damage_fraction": 1.0,
      "reconstructed_text": "clear.",
      "reconstruction_confidence": 0.3368,
      "uncertain": true,
      "final_text": "clear.",
      "provenance": "reconstructed"
    }
  ],
  "evaluation": {
    "ground_truth_text": "The scud had banked over the moon, and it was now quite dark.",
    "cer": 0.0656,
    "wer": 0.0769,
    "reconstruction_top1_accuracy": 0.0,
    "content_word_accuracy": 0.0
  }
}