{
  "document_id": "test_0433",
  "source_image_path": "held_out_temp_images/test_0433_clean.png",
  "page_number": 1,
  "confidence_threshold": 0.5442,
  "final_text": "But indeed, Utterson, | am very glad to see you; this is really a -days pleasure; | would ask you and Mr.",
  "words": [
    {
      "word_index": 0,
      "bounding_box": {
        "left": 42,
        "top": 45,
        "width": 33,
        "height": 17
      },
      "ocr_text": "But",
      "ocr_confidence": 96.0,
      "damage_status": "intact",
      "damage_fraction": 0.0,
      "reconstructed_text": null,
      "reconstruction_confidence": null,
      "uncertain": null,
      "final_text": "But",
      "provenance": "ocr"
    },
    {
      "word_index": 1,
      "bounding_box": {
        "left": 85,
        "top": 45,
        "width": 73,
        "height": 20
      },
      "ocr_text": "indeed,",
      "ocr_confidence": 93.0,
      "damage_status": "intact",
      "damage_fraction": 0.0,
      "reconstructed_text": null,
      "reconstruction_confidence": null,
      "uncertain": null,
      "final_text": "indeed,",
      "provenance": "ocr"
    },
    {
      "word_index": 2,
      "bounding_box": {
        "left": 169,
        "top": 45,
        "width": 93,
        "height": 20
      },
      "ocr_text": "Utterson,",
      "ocr_confidence": 92.0,
      "damage_status": "intact",
      "damage_fraction": 0.0,
      "reconstructed_text": null,
      "reconstruction_confidence": null,
      "uncertain": null,
      "final_text": "Utterson,",
      "provenance": "ocr"
    },
    {
      "word_index": 3,
      "bounding_box": {
        "left": 273,
        "top": 45,
        "width": 3,
        "height": 17
      },
      "ocr_text": "|",
      "ocr_confidence": 95.0,
      "damage_status": "intact",
      "damage_fraction": 0.0,
      "reconstructed_text": null,
      "reconstruction_confidence": null,
      "uncertain": null,
      "final_text": "|",
      "provenance": "ocr"
    },
    {
      "word_index": 4,
      "bounding_box": {
        "left": 286,
        "top": 49,
        "width": 31,
        "height": 13
      },
      "ocr_text": "am",
      "ocr_confidence": 96.0,
      "damage_status": "intact",
      "damage_fraction": 0.0,
      "reconstructed_text": null,
      "reconstruction_confidence": null,
      "uncertain": null,
      "final_text": "am",
      "provenance": "ocr"
    },
    {
      "word_index": 5,
      "bounding_box": {
        "left": 325,
        "top": 49,
        "width": 45,
        "height": 18
      },
      "ocr_text": "very",
      "ocr_confidence": 96.0,
      "damage_status": "intact",
      "damage_fraction": 0.0,
      "reconstructed_text": null,
      "reconstruction_confidence": null,
      "uncertain": null,
      "final_text": "very",
      "provenance": "ocr"
    },
    {
      "word_index": 6,
      "bounding_box": {
        "left": 378,
        "top": 45,
        "width": 42,
        "height": 22
      },
      "ocr_text": "glad",
      "ocr_confidence": 96.0,
      "damage_status": "intact",
      "damage_fraction": 0.0,
      "reconstructed_text": null,
      "reconstruction_confidence": null,
      "uncertain": null,
      "final_text": "glad",
      "provenance": "ocr"
    },
    {
      "word_index": 7,
      "bounding_box": {
        "left": 428,
        "top": 45,
        "width": 20,
        "height": 17
      },
      "ocr_text": "to",
      "ocr_confidence": 96.0,
      "damage_status": "intact",
      "damage_fraction": 0.0,
      "reconstructed_text": null,
      "reconstruction_confidence": null,
      "uncertain": null,
      "final_text": "to",
      "provenance": "ocr"
    },
    {
      "word_index": 8,
      "bounding_box": {
        "left": 456,
        "top": 49,
        "width": 36,
        "height": 13
      },
      "ocr_text": "see",
      "ocr_confidence": 96.0,
      "damage_status": "intact",
      "damage_fraction": 0.0,
      "reconstructed_text": null,
      "reconstruction_confidence": null,
      "uncertain": null,
      "final_text": "see",
      "provenance": "ocr"
    },
    {
      "word_index": 9,
      "bounding_box": {
        "left": 500,
        "top": 49,
        "width": 43,
        "height": 18
      },
      "ocr_text": "you;",
      "ocr_confidence": 96.0,
      "damage_status": "intact",
      "damage_fraction": 0.0,
      "reconstructed_text": null,
      "reconstruction_confidence": null,
      "uncertain": null,
      "final_text": "you;",
      "provenance": "ocr"
    },
    {
      "word_index": 10,
      "bounding_box": {
        "left": 552,
        "top": 45,
        "width": 36,
        "height": 17
      },
      "ocr_text": "this",
      "ocr_confidence": 96.0,
      "damage_status": "intact",
      "damage_fraction": 0.0,
      "reconstructed_text": null,
      "reconstruction_confidence": null,
      "uncertain": null,
      "final_text": "this",
      "provenance": "ocr"
    },
    {
      "word_index": 11,
      "bounding_box": {
        "left": 598,
        "top": 45,
        "width": 14,
        "height": 17
      },
      "ocr_text": "is",
      "ocr_confidence": 96.0,
      "damage_status": "intact",
      "damage_fraction": 0.0,
      "reconstructed_text": null,
      "reconstruction_confidence": null,
      "uncertain": null,
      "final_text": "is",
      "provenance": "ocr"
    },
    {
      "word_index": 12,
      "bounding_box": {
        "left": 621,
        "top": 45,
        "width": 55,
        "height": 22
      },
      "ocr_text": "really",
      "ocr_confidence": 96.0,
      "damage_status": "intact",
      "damage_fraction": 0.0,
      "reconstructed_text": null,
      "reconstruction_confidence": null,
      "uncertain": null,
      "final_text": "really",
      "provenance": "ocr"
    },
    {
      "word_index": 13,
      "bounding_box": {
        "left": 684,
        "top": 49,
        "width": 11,
        "height": 13
      },
      "ocr_text": "2",
      "ocr_confidence": 90.0,
      "damage_status": "partial",
      "damage_fraction": 0.1678,
      "reconstructed_text": "a",
      "reconstruction_confidence": 0.3872,
      "uncertain": true,
      "final_text": "a",
      "provenance": "reconstructed"
    },
    {
      "word_index": 14,
      "bounding_box": {
        "left": 704,
        "top": 45,
        "width": 52,
        "height": 22
      },
      "ocr_text": null,
      "ocr_confidence": null,
      "damage_status": "missing",
      "damage_fraction": 0.9991,
      "reconstructed_text": "-days",
      "reconstruction_confidence": 0.2363,
      "uncertain": true,
      "final_text": "-days",
      "provenance": "reconstructed"
    },
    {
      "word_index": 15,
      "bounding_box": {
        "left": 765,
        "top": 45,
        "width": 94,
        "height": 22
      },
      "ocr_text": "pleasure;",
      "ocr_confidence": 96.0,
      "damage_status": "intact",
      "damage_fraction": 0.0,
      "reconstructed_text": null,
      "reconstruction_confidence": null,
      "uncertain": null,
      "final_text": "pleasure;",
      "provenance": "ocr"
    },
    {
      "word_index": 16,
      "bounding_box": {
        "left": 870,
        "top": 45,
        "width": 3,
        "height": 17
      },
      "ocr_text": "|",
      "ocr_confidence": 95.0,
      "damage_status": "intact",
      "damage_fraction": 0.0,
      "reconstructed_text": null,
      "reconstruction_confidence": null,
      "uncertain": null,
      "final_text": "|",
      "provenance": "ocr"
    },
    {
      "word_index": 17,
      "bounding_box": {
        "left": 882,
        "top": 45,
        "width": 60,
        "height": 17
      },
      "ocr_text": "would",
      "ocr_confidence": 96.0,
      "damage_status": "intact",
      "damage_fraction": 0.0,
      "reconstructed_text": null,
      "reconstruction_confidence": null,
      "uncertain": null,
      "final_text": "would",
      "provenance": "ocr"
    },
    {
      "word_index": 18,
      "bounding_box": {
        "left": 951,
        "top": 45,
        "width": 36,
        "height": 17
      },
      "ocr_text": "ask",
      "ocr_confidence": 96.0,
      "damage_status": "intact",
      "damage_fraction": 0.0,
      "reconstructed_text": null,
      "reconstruction_confidence": null,
      "uncertain": null,
      "final_text": "ask",
      "provenance": "ocr"
    },
    {
      "word_index": 19,
      "bounding_box": {
        "left": 994,
        "top": 49,
        "width": 37,
        "height": 18
      },
      "ocr_text": "you",
      "ocr_confidence": 96.0,
      "damage_status": "intact",
      "damage_fraction": 0.0,
      "reconstructed_text": null,
      "reconstruction_confidence": null,
      "uncertain": null,
      "final_text": "you",
      "provenance": "ocr"
    },
    {
      "word_index": 20,
      "bounding_box": {
        "left": 1040,
        "top": 45,
        "width": 37,
        "height": 17
      },
      "ocr_text": "and",
      "ocr_confidence": 96.0,
      "damage_status": "intact",
      "damage_fraction": 0.0,
      "reconstructed_text": null,
      "reconstruction_confidence": null,
      "uncertain": null,
      "final_text": "and",
      "provenance": "ocr"
    },
    {
      "word_index": 21,
      "bounding_box": {
        "left": 1087,
        "top": 45,
        "width": 31,
        "height": 17
      },
      "ocr_text": "Mr.",
      "ocr_confidence": 95.0,
      "damage_status": "intact",
      "damage_fraction": 0.0,
      "reconstructed_text": null,
      "reconstruction_confidence": null,
      "uncertain": null,
      "final_text": "Mr.",
      "provenance": "ocr"
    }
  ],
  "evaluation": {
    "ground_truth_text": "But indeed, Utterson, | am very glad to see you; this is really a great pleasure; | would ask you and Mr.",
    "cer": 0.0476,
    "wer": 0.0455,
    "reconstruction_top1_accuracy": 0.0,
    "content_word_accuracy": 0.0
  }
}