{
  "document_id": "test_0653",
  "source_image_path": "held_out_temp_images/test_0653_clean.png",
  "page_number": 1,
  "confidence_threshold": 0.5442,
  "final_text": "At the sight that met my eyes, my blood was changed into something exquisitely thin and icy.",
  "words": [
    {
      "word_index": 0,
      "bounding_box": {
        "left": 40,
        "top": 45,
        "width": 22,
        "height": 17
      },
      "ocr_text": "At",
      "ocr_confidence": 96.0,
      "damage_status": "intact",
      "damage_fraction": 0.0,
      "reconstructed_text": null,
      "reconstruction_confidence": null,
      "uncertain": null,
      "final_text": "At",
      "provenance": "ocr"
    },
    {
      "word_index": 1,
      "bounding_box": {
        "left": 70,
        "top": 45,
        "width": 32,
        "height": 17
      },
      "ocr_text": "the",
      "ocr_confidence": 96.0,
      "damage_status": "intact",
      "damage_fraction": 0.0,
      "reconstructed_text": null,
      "reconstruction_confidence": null,
      "uncertain": null,
      "final_text": "the",
      "provenance": "ocr"
    },
    {
      "word_index": 2,
      "bounding_box": {
        "left": 111,
        "top": 45,
        "width": 48,
        "height": 22
      },
      "ocr_text": "sight",
      "ocr_confidence": 96.0,
      "damage_status": "intact",
      "damage_fraction": 0.0,
      "reconstructed_text": null,
      "reconstruction_confidence": null,
      "uncertain": null,
      "final_text": "sight",
      "provenance": "ocr"
    },
    {
      "word_index": 3,
      "bounding_box": {
        "left": 167,
        "top": 45,
        "width": 39,
        "height": 17
      },
      "ocr_text": "that",
      "ocr_confidence": 96.0,
      "damage_status": "intact",
      "damage_fraction": 0.0,
      "reconstructed_text": null,
      "reconstruction_confidence": null,
      "uncertain": null,
      "final_text": "that",
      "provenance": "ocr"
    },
    {
      "word_index": 4,
      "bounding_box": {
        "left": 216,
        "top": 45,
        "width": 37,
        "height": 17
      },
      "ocr_text": "met",
      "ocr_confidence": 96.0,
      "damage_status": "intact",
      "damage_fraction": 0.0,
      "reconstructed_text": null,
      "reconstruction_confidence": null,
      "uncertain": null,
      "final_text": "met",
      "provenance": "ocr"
    },
    {
      "word_index": 5,
      "bounding_box": {
        "left": 263,
        "top": 49,
        "width": 30,
        "height": 18
      },
      "ocr_text": "my",
      "ocr_confidence": 96.0,
      "damage_status": "intact",
      "damage_fraction": 0.0,
      "reconstructed_text": null,
      "reconstruction_confidence": null,
      "uncertain": null,
      "final_text": "my",
      "provenance": "ocr"
    },
    {
      "word_index": 6,
      "bounding_box": {
        "left": 301,
        "top": 49,
        "width": 54,
        "height": 18
      },
      "ocr_text": "eyes,",
      "ocr_confidence": 96.0,
      "damage_status": "intact",
      "damage_fraction": 0.0,
      "reconstructed_text": null,
      "reconstruction_confidence": null,
      "uncertain": null,
      "final_text": "eyes,",
      "provenance": "ocr"
    },
    {
      "word_index": 7,
      "bounding_box": {
        "left": 366,
        "top": 49,
        "width": 30,
        "height": 18
      },
      "ocr_text": null,
      "ocr_confidence": null,
      "damage_status": "missing",
      "damage_fraction": 1.0,
      "reconstructed_text": "my",
      "reconstruction_confidence": 0.7108,
      "uncertain": false,
      "final_text": "my",
      "provenance": "reconstructed"
    },
    {
      "word_index": 8,
      "bounding_box": {
        "left": 405,
        "top": 45,
        "width": 54,
        "height": 17
      },
      "ocr_text": "blood",
      "ocr_confidence": 96.0,
      "damage_status": "intact",
      "damage_fraction": 0.0022,
      "reconstructed_text": null,
      "reconstruction_confidence": null,
      "uncertain": null,
      "final_text": "blood",
      "provenance": "ocr"
    },
    {
      "word_index": 9,
      "bounding_box": {
        "left": 467,
        "top": 49,
        "width": 41,
        "height": 13
      },
      "ocr_text": "was",
      "ocr_confidence": 96.0,
      "damage_status": "intact",
      "damage_fraction": 0.0,
      "reconstructed_text": null,
      "reconstruction_confidence": null,
      "uncertain": null,
      "final_text": "was",
      "provenance": "ocr"
    },
    {
      "word_index": 10,
      "bounding_box": {
        "left": 517,
        "top": 45,
        "width": 88,
        "height": 22
      },
      "ocr_text": "changed",
      "ocr_confidence": 96.0,
      "damage_status": "intact",
      "damage_fraction": 0.0,
      "reconstructed_text": null,
      "reconstruction_confidence": null,
      "uncertain": null,
      "final_text": "changed",
      "provenance": "ocr"
    },
    {
      "word_index": 11,
      "bounding_box": {
        "left": 615,
        "top": 45,
        "width": 35,
        "height": 17
      },
      "ocr_text": "into",
      "ocr_confidence": 96.0,
      "damage_status": "intact",
      "damage_fraction": 0.0,
      "reconstructed_text": null,
      "reconstruction_confidence": null,
      "uncertain": null,
      "final_text": "into",
      "provenance": "ocr"
    },
    {
      "word_index": 12,
      "bounding_box": {
        "left": 659,
        "top": 45,
        "width": 107,
        "height": 22
      },
      "ocr_text": "something",
      "ocr_confidence": 96.0,
      "damage_status": "intact",
      "damage_fraction": 0.0,
      "reconstructed_text": null,
      "reconstruction_confidence": null,
      "uncertain": null,
      "final_text": "something",
      "provenance": "ocr"
    },
    {
      "word_index": 13,
      "bounding_box": {
        "left": 775,
        "top": 45,
        "width": 109,
        "height": 22
      },
      "ocr_text": "exquisitely",
      "ocr_confidence": 96.0,
      "damage_status": "intact",
      "damage_fraction": 0.0,
      "reconstructed_text": null,
      "reconstruction_confidence": null,
      "uncertain": null,
      "final_text": "exquisitely",
      "provenance": "ocr"
    },
    {
      "word_index": 14,
      "bounding_box": {
        "left": 891,
        "top": 45,
        "width": 37,
        "height": 17
      },
      "ocr_text": "thin",
      "ocr_confidence": 96.0,
      "damage_status": "intact",
      "damage_fraction": 0.0,
      "reconstructed_text": null,
      "reconstruction_confidence": null,
      "uncertain": null,
      "final_text": "thin",
      "provenance": "ocr"
    },
    {
      "word_index": 15,
      "bounding_box": {
        "left": 937,
        "top": 45,
        "width": 37,
        "height": 17
      },
      "ocr_text": "and",
      "ocr_confidence": 96.0,
      "damage_status": "intact",
      "damage_fraction": 0.0,
      "reconstructed_text": null,
      "reconstruction_confidence": null,
      "uncertain": null,
      "final_text": "and",
      "provenance": "ocr"
    },
    {
      "word_index": 16,
      "bounding_box": {
        "left": 984,
        "top": 45,
        "width": 32,
        "height": 22
      },
      "ocr_text": "icy.",
      "ocr_confidence": 96.0,
      "damage_status": "intact",
      "damage_fraction": 0.0,
      "reconstructed_text": null,
      "reconstruction_confidence": null,
      "uncertain": null,
      "final_text": "icy.",
      "provenance": "ocr"
    }
  ],
  "evaluation": {
    "ground_truth_text": "At the sight that met my eyes, my blood was changed into something exquisitely thin and icy.",
    "cer": 0.0,
    "wer": 0.0,
    "reconstruction_top1_accuracy": 1.0,
    "content_word_accuracy": 1.0
  }
}