{
  "document_id": "test_0665",
  "source_image_path": "held_out_temp_images/test_0665_clean.png",
  "page_number": 1,
  "confidence_threshold": 0.5442,
  "final_text": "My two natures had memory in common, but all other faculties were most unequally shared between them.",
  "words": [
    {
      "word_index": 0,
      "bounding_box": {
        "left": 42,
        "top": 45,
        "width": 30,
        "height": 22
      },
      "ocr_text": "My",
      "ocr_confidence": 96.0,
      "damage_status": "intact",
      "damage_fraction": 0.0,
      "reconstructed_text": null,
      "reconstruction_confidence": null,
      "uncertain": null,
      "final_text": "My",
      "provenance": "ocr"
    },
    {
      "word_index": 1,
      "bounding_box": {
        "left": 79,
        "top": 45,
        "width": 37,
        "height": 17
      },
      "ocr_text": "two",
      "ocr_confidence": 95.0,
      "damage_status": "intact",
      "damage_fraction": 0.0,
      "reconstructed_text": null,
      "reconstruction_confidence": null,
      "uncertain": null,
      "final_text": "two",
      "provenance": "ocr"
    },
    {
      "word_index": 2,
      "bounding_box": {
        "left": 124,
        "top": 45,
        "width": 77,
        "height": 17
      },
      "ocr_text": "natures",
      "ocr_confidence": 96.0,
      "damage_status": "intact",
      "damage_fraction": 0.0,
      "reconstructed_text": null,
      "reconstruction_confidence": null,
      "uncertain": null,
      "final_text": "natures",
      "provenance": "ocr"
    },
    {
      "word_index": 3,
      "bounding_box": {
        "left": 210,
        "top": 45,
        "width": 37,
        "height": 17
      },
      "ocr_text": "had",
      "ocr_confidence": 96.0,
      "damage_status": "intact",
      "damage_fraction": 0.0,
      "reconstructed_text": null,
      "reconstruction_confidence": null,
      "uncertain": null,
      "final_text": "had",
      "provenance": "ocr"
    },
    {
      "word_index": 4,
      "bounding_box": {
        "left": 256,
        "top": 49,
        "width": 85,
        "height": 18
      },
      "ocr_text": "memory",
      "ocr_confidence": 96.0,
      "damage_status": "intact",
      "damage_fraction": 0.0,
      "reconstructed_text": null,
      "reconstruction_confidence": null,
      "uncertain": null,
      "final_text": "memory",
      "provenance": "ocr"
    },
    {
      "word_index": 5,
      "bounding_box": {
        "left": 350,
        "top": 45,
        "width": 15,
        "height": 17
      },
      "ocr_text": "in",
      "ocr_confidence": 95.0,
      "damage_status": "intact",
      "damage_fraction": 0.0,
      "reconstructed_text": null,
      "reconstruction_confidence": null,
      "uncertain": null,
      "final_text": "in",
      "provenance": "ocr"
    },
    {
      "word_index": 6,
      "bounding_box": {
        "left": 374,
        "top": 49,
        "width": 95,
        "height": 16
      },
      "ocr_text": "common,",
      "ocr_confidence": 95.0,
      "damage_status": "intact",
      "damage_fraction": 0.0,
      "reconstructed_text": null,
      "reconstruction_confidence": null,
      "uncertain": null,
      "final_text": "common,",
      "provenance": "ocr"
    },
    {
      "word_index": 7,
      "bounding_box": {
        "left": 479,
        "top": 45,
        "width": 31,
        "height": 17
      },
      "ocr_text": "but",
      "ocr_confidence": 96.0,
      "damage_status": "intact",
      "damage_fraction": 0.0,
      "reconstructed_text": null,
      "reconstruction_confidence": null,
      "uncertain": null,
      "final_text": "but",
      "provenance": "ocr"
    },
    {
      "word_index": 8,
      "bounding_box": {
        "left": 519,
        "top": 45,
        "width": 21,
        "height": 17
      },
      "ocr_text": "all",
      "ocr_confidence": 96.0,
      "damage_status": "intact",
      "damage_fraction": 0.0,
      "reconstructed_text": null,
      "reconstruction_confidence": null,
      "uncertain": null,
      "final_text": "all",
      "provenance": "ocr"
    },
    {
      "word_index": 9,
      "bounding_box": {
        "left": 549,
        "top": 45,
        "width": 53,
        "height": 17
      },
      "ocr_text": "other",
      "ocr_confidence": 96.0,
      "damage_status": "intact",
      "damage_fraction": 0.0,
      "reconstructed_text": null,
      "reconstruction_confidence": null,
      "uncertain": null,
      "final_text": "other",
      "provenance": "ocr"
    },
    {
      "word_index": 10,
      "bounding_box": {
        "left": 609,
        "top": 45,
        "width": 86,
        "height": 17
      },
      "ocr_text": "faculties",
      "ocr_confidence": 96.0,
      "damage_status": "intact",
      "damage_fraction": 0.0,
      "reconstructed_text": null,
      "reconstruction_confidence": null,
      "uncertain": null,
      "final_text": "faculties",
      "provenance": "ocr"
    },
    {
      "word_index": 11,
      "bounding_box": {
        "left": 703,
        "top": 49,
        "width": 50,
        "height": 13
      },
      "ocr_text": "were",
      "ocr_confidence": 95.0,
      "damage_status": "intact",
      "damage_fraction": 0.0,
      "reconstructed_text": null,
      "reconstruction_confidence": null,
      "uncertain": null,
      "final_text": "were",
      "provenance": "ocr"
    },
    {
      "word_index": 12,
      "bounding_box": {
        "left": 762,
        "top": 45,
        "width": 50,
        "height": 17
      },
      "ocr_text": "most",
      "ocr_confidence": 96.0,
      "damage_status": "intact",
      "damage_fraction": 0.0,
      "reconstructed_text": null,
      "reconstruction_confidence": null,
      "uncertain": null,
      "final_text": "most",
      "provenance": "ocr"
    },
    {
      "word_index": 13,
      "bounding_box": {
        "left": 821,
        "top": 45,
        "width": 99,
        "height": 22
      },
      "ocr_text": "unequally",
      "ocr_confidence": 96.0,
      "damage_status": "intact",
      "damage_fraction": 0.0,
      "reconstructed_text": null,
      "reconstruction_confidence": null,
      "uncertain": null,
      "final_text": "unequally",
      "provenance": "ocr"
    },
    {
      "word_index": 14,
      "bounding_box": {
        "left": 928,
        "top": 45,
        "width": 70,
        "height": 17
      },
      "ocr_text": "shared",
      "ocr_confidence": 96.0,
      "damage_status": "intact",
      "damage_fraction": 0.0,
      "reconstructed_text": null,
      "reconstruction_confidence": null,
      "uncertain": null,
      "final_text": "shared",
      "provenance": "ocr"
    },
    {
      "word_index": 15,
      "bounding_box": {
        "left": 1007,
        "top": 45,
        "width": 87,
        "height": 17
      },
      "ocr_text": "between",
      "ocr_confidence": 96.0,
      "damage_status": "intact",
      "damage_fraction": 0.0,
      "reconstructed_text": null,
      "reconstruction_confidence": null,
      "uncertain": null,
      "final_text": "between",
      "provenance": "ocr"
    },
    {
      "word_index": 16,
      "bounding_box": {
        "left": 1102,
        "top": 45,
        "width": 58,
        "height": 17
      },
      "ocr_text": null,
      "ocr_confidence": null,
      "damage_status": "missing",
      "damage_fraction": 1.0,
      "reconstructed_text": "them.",
      "reconstruction_confidence": 0.9655,
      "uncertain": false,
      "final_text": "them.",
      "provenance": "reconstructed"
    }
  ],
  "evaluation": {
    "ground_truth_text": "My two natures had memory in common, but all other faculties were most unequally shared between them.",
    "cer": 0.0,
    "wer": 0.0,
    "reconstruction_top1_accuracy": 1.0,
    "content_word_accuracy": 1.0
  }
}