{
  "document_id": "test_0225",
  "source_image_path": "held_out_temp_images/test_0225_clean.png",
  "page_number": 1,
  "confidence_threshold": 0.5442,
  "final_text": "It was a man of the name of Hyde.\u201d \u201cHm,\u201d said Mr.",
  "words": [
    {
      "word_index": 0,
      "bounding_box": {
        "left": 42,
        "top": 45,
        "width": 11,
        "height": 17
      },
      "ocr_text": "It",
      "ocr_confidence": 91.0,
      "damage_status": "intact",
      "damage_fraction": 0.0,
      "reconstructed_text": null,
      "reconstruction_confidence": null,
      "uncertain": null,
      "final_text": "It",
      "provenance": "ocr"
    },
    {
      "word_index": 1,
      "bounding_box": {
        "left": 61,
        "top": 49,
        "width": 41,
        "height": 13
      },
      "ocr_text": "was",
      "ocr_confidence": 96.0,
      "damage_status": "intact",
      "damage_fraction": 0.0,
      "reconstructed_text": null,
      "reconstruction_confidence": null,
      "uncertain": null,
      "final_text": "was",
      "provenance": "ocr"
    },
    {
      "word_index": 2,
      "bounding_box": {
        "left": 111,
        "top": 49,
        "width": 11,
        "height": 13
      },
      "ocr_text": "a",
      "ocr_confidence": 96.0,
      "damage_status": "intact",
      "damage_fraction": 0.0,
      "reconstructed_text": null,
      "reconstruction_confidence": null,
      "uncertain": null,
      "final_text": "a",
      "provenance": "ocr"
    },
    {
      "word_index": 3,
      "bounding_box": {
        "left": 132,
        "top": 49,
        "width": 43,
        "height": 13
      },
      "ocr_text": "man",
      "ocr_confidence": 96.0,
      "damage_status": "intact",
      "damage_fraction": 0.0,
      "reconstructed_text": null,
      "reconstruction_confidence": null,
      "uncertain": null,
      "final_text": "man",
      "provenance": "ocr"
    },
    {
      "word_index": 4,
      "bounding_box": {
        "left": 184,
        "top": 45,
        "width": 19,
        "height": 17
      },
      "ocr_text": "of",
      "ocr_confidence": 96.0,
      "damage_status": "intact",
      "damage_fraction": 0.0,
      "reconstructed_text": null,
      "reconstruction_confidence": null,
      "uncertain": null,
      "final_text": "of",
      "provenance": "ocr"
    },
    {
      "word_index": 5,
      "bounding_box": {
        "left": 210,
        "top": 45,
        "width": 32,
        "height": 17
      },
      "ocr_text": null,
      "ocr_confidence": null,
      "damage_status": "missing",
      "damage_fraction": 1.0,
      "reconstructed_text": "the",
      "reconstruction_confidence": 0.9991,
      "uncertain": false,
      "final_text": "the",
      "provenance": "reconstructed"
    },
    {
      "word_index": 6,
      "bounding_box": {
        "left": 252,
        "top": 49,
        "width": 56,
        "height": 13
      },
      "ocr_text": "name",
      "ocr_confidence": 95.0,
      "damage_status": "intact",
      "damage_fraction": 0.0,
      "reconstructed_text": null,
      "reconstruction_confidence": null,
      "uncertain": null,
      "final_text": "name",
      "provenance": "ocr"
    },
    {
      "word_index": 7,
      "bounding_box": {
        "left": 317,
        "top": 45,
        "width": 19,
        "height": 17
      },
      "ocr_text": "of",
      "ocr_confidence": 96.0,
      "damage_status": "intact",
      "damage_fraction": 0.0,
      "reconstructed_text": null,
      "reconstruction_confidence": null,
      "uncertain": null,
      "final_text": "of",
      "provenance": "ocr"
    },
    {
      "word_index": 8,
      "bounding_box": {
        "left": 345,
        "top": 45,
        "width": 67,
        "height": 22
      },
      "ocr_text": "Hyde.\u201d",
      "ocr_confidence": 96.0,
      "damage_status": "intact",
      "damage_fraction": 0.0,
      "reconstructed_text": null,
      "reconstruction_confidence": null,
      "uncertain": null,
      "final_text": "Hyde.\u201d",
      "provenance": "ocr"
    },
    {
      "word_index": 9,
      "bounding_box": {
        "left": 421,
        "top": 45,
        "width": 58,
        "height": 20
      },
      "ocr_text": "\u201cHm,\u201d",
      "ocr_confidence": 95.0,
      "damage_status": "intact",
      "damage_fraction": 0.0,
      "reconstructed_text": null,
      "reconstruction_confidence": null,
      "uncertain": null,
      "final_text": "\u201cHm,\u201d",
      "provenance": "ocr"
    },
    {
      "word_index": 10,
      "bounding_box": {
        "left": 488,
        "top": 45,
        "width": 41,
        "height": 17
      },
      "ocr_text": "said",
      "ocr_confidence": 95.0,
      "damage_status": "intact",
      "damage_fraction": 0.0,
      "reconstructed_text": null,
      "reconstruction_confidence": null,
      "uncertain": null,
      "final_text": "said",
      "provenance": "ocr"
    },
    {
      "word_index": 11,
      "bounding_box": {
        "left": 539,
        "top": 45,
        "width": 31,
        "height": 17
      },
      "ocr_text": "Mr.",
      "ocr_confidence": 96.0,
      "damage_status": "intact",
      "damage_fraction": 0.0,
      "reconstructed_text": null,
      "reconstruction_confidence": null,
      "uncertain": null,
      "final_text": "Mr.",
      "provenance": "ocr"
    }
  ],
  "evaluation": {
    "ground_truth_text": "It was a man of the name of Hyde.\u201d \u201cHm,\u201d said Mr.",
    "cer": 0.0,
    "wer": 0.0,
    "reconstruction_top1_accuracy": 1.0,
    "content_word_accuracy": null
  }
}