{
  "document_id": "test_0243",
  "source_image_path": "held_out_temp_images/test_0243_clean.png",
  "page_number": 1,
  "confidence_threshold": 0.5442,
  "final_text": "The will was holograph, for example.",
  "words": [
    {
      "word_index": 0,
      "bounding_box": {
        "left": 40,
        "top": 45,
        "width": 40,
        "height": 17
      },
      "ocr_text": "The",
      "ocr_confidence": 96.0,
      "damage_status": "intact",
      "damage_fraction": 0.0,
      "reconstructed_text": null,
      "reconstruction_confidence": null,
      "uncertain": null,
      "final_text": "The",
      "provenance": "ocr"
    },
    {
      "word_index": 1,
      "bounding_box": {
        "left": 88,
        "top": 45,
        "width": 31,
        "height": 17
      },
      "ocr_text": "will",
      "ocr_confidence": 96.0,
      "damage_status": "intact",
      "damage_fraction": 0.0,
      "reconstructed_text": null,
      "reconstruction_confidence": null,
      "uncertain": null,
      "final_text": "will",
      "provenance": "ocr"
    },
    {
      "word_index": 2,
      "bounding_box": {
        "left": 127,
        "top": 49,
        "width": 41,
        "height": 13
      },
      "ocr_text": "was",
      "ocr_confidence": 93.0,
      "damage_status": "intact",
      "damage_fraction": 0.0,
      "reconstructed_text": null,
      "reconstruction_confidence": null,
      "uncertain": null,
      "final_text": "was",
      "provenance": "ocr"
    },
    {
      "word_index": 3,
      "bounding_box": {
        "left": 177,
        "top": 45,
        "width": 108,
        "height": 22
      },
      "ocr_text": "holograph,",
      "ocr_confidence": 92.0,
      "damage_status": "intact",
      "damage_fraction": 0.0,
      "reconstructed_text": null,
      "reconstruction_confidence": null,
      "uncertain": null,
      "final_text": "holograph,",
      "provenance": "ocr"
    },
    {
      "word_index": 4,
      "bounding_box": {
        "left": 294,
        "top": 45,
        "width": 28,
        "height": 17
      },
      "ocr_text": "for",
      "ocr_confidence": 97.0,
      "damage_status": "intact",
      "damage_fraction": 0.0,
      "reconstructed_text": null,
      "reconstruction_confidence": null,
      "uncertain": null,
      "final_text": "for",
      "provenance": "ocr"
    },
    {
      "word_index": 5,
      "bounding_box": {
        "left": 331,
        "top": 45,
        "width": 31,
        "height": 17
      },
      "ocr_text": null,
      "ocr_confidence": null,
      "damage_status": "missing",
      "damage_fraction": 1.0,
      "reconstructed_text": "example.",
      "reconstruction_confidence": 0.2876,
      "uncertain": true,
      "final_text": "example.",
      "provenance": "reconstructed"
    }
  ],
  "evaluation": {
    "ground_truth_text": "The will was holograph, for Mr.",
    "cer": 0.2258,
    "wer": 0.1667,
    "reconstruction_top1_accuracy": 0.0,
    "content_word_accuracy": 0.0
  }
}