{
  "document_id": "test_0316",
  "source_image_path": "held_out_temp_images/test_0316_clean.png",
  "page_number": 1,
  "confidence_threshold": 0.5442,
  "final_text": "This was no new arrangement, but a thing that hac kered many scores of times.",
  "words": [
    {
      "word_index": 0,
      "bounding_box": {
        "left": 40,
        "top": 45,
        "width": 44,
        "height": 17
      },
      "ocr_text": "This",
      "ocr_confidence": 96.0,
      "damage_status": "intact",
      "damage_fraction": 0.0,
      "reconstructed_text": null,
      "reconstruction_confidence": null,
      "uncertain": null,
      "final_text": "This",
      "provenance": "ocr"
    },
    {
      "word_index": 1,
      "bounding_box": {
        "left": 92,
        "top": 49,
        "width": 41,
        "height": 13
      },
      "ocr_text": "was",
      "ocr_confidence": 96.0,
      "damage_status": "intact",
      "damage_fraction": 0.0,
      "reconstructed_text": null,
      "reconstruction_confidence": null,
      "uncertain": null,
      "final_text": "was",
      "provenance": "ocr"
    },
    {
      "word_index": 2,
      "bounding_box": {
        "left": 142,
        "top": 49,
        "width": 25,
        "height": 13
      },
      "ocr_text": "no",
      "ocr_confidence": 96.0,
      "damage_status": "intact",
      "damage_fraction": 0.0,
      "reconstructed_text": null,
      "reconstruction_confidence": null,
      "uncertain": null,
      "final_text": "no",
      "provenance": "ocr"
    },
    {
      "word_index": 3,
      "bounding_box": {
        "left": 175,
        "top": 49,
        "width": 42,
        "height": 13
      },
      "ocr_text": "new",
      "ocr_confidence": 96.0,
      "damage_status": "intact",
      "damage_fraction": 0.0,
      "reconstructed_text": null,
      "reconstruction_confidence": null,
      "uncertain": null,
      "final_text": "new",
      "provenance": "ocr"
    },
    {
      "word_index": 4,
      "bounding_box": {
        "left": 225,
        "top": 45,
        "width": 138,
        "height": 22
      },
      "ocr_text": "arrangement,",
      "ocr_confidence": 96.0,
      "damage_status": "intact",
      "damage_fraction": 0.0,
      "reconstructed_text": null,
      "reconstruction_confidence": null,
      "uncertain": null,
      "final_text": "arrangement,",
      "provenance": "ocr"
    },
    {
      "word_index": 5,
      "bounding_box": {
        "left": 373,
        "top": 45,
        "width": 31,
        "height": 17
      },
      "ocr_text": "but",
      "ocr_confidence": 96.0,
      "damage_status": "intact",
      "damage_fraction": 0.0,
      "reconstructed_text": null,
      "reconstruction_confidence": null,
      "uncertain": null,
      "final_text": "but",
      "provenance": "ocr"
    },
    {
      "word_index": 6,
      "bounding_box": {
        "left": 413,
        "top": 49,
        "width": 11,
        "height": 13
      },
      "ocr_text": "a",
      "ocr_confidence": 96.0,
      "damage_status": "intact",
      "damage_fraction": 0.0,
      "reconstructed_text": null,
      "reconstruction_confidence": null,
      "uncertain": null,
      "final_text": "a",
      "provenance": "ocr"
    },
    {
      "word_index": 7,
      "bounding_box": {
        "left": 432,
        "top": 45,
        "width": 50,
        "height": 22
      },
      "ocr_text": "thing",
      "ocr_confidence": 96.0,
      "damage_status": "intact",
      "damage_fraction": 0.0,
      "reconstructed_text": null,
      "reconstruction_confidence": null,
      "uncertain": null,
      "final_text": "thing",
      "provenance": "ocr"
    },
    {
      "word_index": 8,
      "bounding_box": {
        "left": 490,
        "top": 45,
        "width": 39,
        "height": 17
      },
      "ocr_text": "that",
      "ocr_confidence": 96.0,
      "damage_status": "intact",
      "damage_fraction": 0.0,
      "reconstructed_text": null,
      "reconstruction_confidence": null,
      "uncertain": null,
      "final_text": "that",
      "provenance": "ocr"
    },
    {
      "word_index": 9,
      "bounding_box": {
        "left": 538,
        "top": 45,
        "width": 37,
        "height": 17
      },
      "ocr_text": "hac",
      "ocr_confidence": 94.0,
      "damage_status": "intact",
      "damage_fraction": 0.0191,
      "reconstructed_text": null,
      "reconstruction_confidence": null,
      "uncertain": null,
      "final_text": "hac",
      "provenance": "ocr"
    },
    {
      "word_index": 10,
      "bounding_box": {
        "left": 584,
        "top": 45,
        "width": 80,
        "height": 17
      },
      "ocr_text": null,
      "ocr_confidence": null,
      "damage_status": "missing",
      "damage_fraction": 0.9985,
      "reconstructed_text": "kered",
      "reconstruction_confidence": 0.8652,
      "uncertain": false,
      "final_text": "kered",
      "provenance": "reconstructed"
    },
    {
      "word_index": 11,
      "bounding_box": {
        "left": 673,
        "top": 49,
        "width": 57,
        "height": 18
      },
      "ocr_text": "many",
      "ocr_confidence": 96.0,
      "damage_status": "intact",
      "damage_fraction": 0.0,
      "reconstructed_text": null,
      "reconstruction_confidence": null,
      "uncertain": null,
      "final_text": "many",
      "provenance": "ocr"
    },
    {
      "word_index": 12,
      "bounding_box": {
        "left": 738,
        "top": 49,
        "width": 68,
        "height": 13
      },
      "ocr_text": "scores",
      "ocr_confidence": 96.0,
      "damage_status": "intact",
      "damage_fraction": 0.0,
      "reconstructed_text": null,
      "reconstruction_confidence": null,
      "uncertain": null,
      "final_text": "scores",
      "provenance": "ocr"
    },
    {
      "word_index": 13,
      "bounding_box": {
        "left": 815,
        "top": 45,
        "width": 19,
        "height": 17
      },
      "ocr_text": "of",
      "ocr_confidence": 96.0,
      "damage_status": "intact",
      "damage_fraction": 0.0,
      "reconstructed_text": null,
      "reconstruction_confidence": null,
      "uncertain": null,
      "final_text": "of",
      "provenance": "ocr"
    },
    {
      "word_index": 14,
      "bounding_box": {
        "left": 841,
        "top": 45,
        "width": 62,
        "height": 17
      },
      "ocr_text": "times.",
      "ocr_confidence": 96.0,
      "damage_status": "intact",
      "damage_fraction": 0.0,
      "reconstructed_text": null,
      "reconstruction_confidence": null,
      "uncertain": null,
      "final_text": "times.",
      "provenance": "ocr"
    }
  ],
  "evaluation": {
    "ground_truth_text": "This was no new arrangement, but a thing that had befallen many scores of times.",
    "cer": 0.0875,
    "wer": 0.1333,
    "reconstruction_top1_accuracy": 0.0,
    "content_word_accuracy": 0.0
  }
}