{
  "document_id": "test_0527",
  "source_image_path": "held_out_temp_images/test_0527_clean.png",
  "page_number": 1,
  "confidence_threshold": 0.5442,
  "final_text": "The lawyer unsealed , and several enclosures fell to the floor.",
  "words": [
    {
      "word_index": 0,
      "bounding_box": {
        "left": 40,
        "top": 45,
        "width": 40,
        "height": 17
      },
      "ocr_text": "The",
      "ocr_confidence": 95.0,
      "damage_status": "intact",
      "damage_fraction": 0.0,
      "reconstructed_text": null,
      "reconstruction_confidence": null,
      "uncertain": null,
      "final_text": "The",
      "provenance": "ocr"
    },
    {
      "word_index": 1,
      "bounding_box": {
        "left": 89,
        "top": 45,
        "width": 67,
        "height": 22
      },
      "ocr_text": "lawyer",
      "ocr_confidence": 95.0,
      "damage_status": "intact",
      "damage_fraction": 0.0,
      "reconstructed_text": null,
      "reconstruction_confidence": null,
      "uncertain": null,
      "final_text": "lawyer",
      "provenance": "ocr"
    },
    {
      "word_index": 2,
      "bounding_box": {
        "left": 164,
        "top": 45,
        "width": 93,
        "height": 17
      },
      "ocr_text": "unsealed",
      "ocr_confidence": 74.0,
      "damage_status": "intact",
      "damage_fraction": 0.0,
      "reconstructed_text": null,
      "reconstruction_confidence": null,
      "uncertain": null,
      "final_text": "unsealed",
      "provenance": "ocr"
    },
    {
      "word_index": 3,
      "bounding_box": {
        "left": 267,
        "top": 45,
        "width": 15,
        "height": 20
      },
      "ocr_text": "_",
      "ocr_confidence": 39.0,
      "damage_status": "missing",
      "damage_fraction": 1.0,
      "reconstructed_text": ",",
      "reconstruction_confidence": 0.5504,
      "uncertain": false,
      "final_text": ",",
      "provenance": "reconstructed"
    },
    {
      "word_index": 4,
      "bounding_box": {
        "left": 292,
        "top": 45,
        "width": 37,
        "height": 17
      },
      "ocr_text": "and",
      "ocr_confidence": 96.0,
      "damage_status": "intact",
      "damage_fraction": 0.0032,
      "reconstructed_text": null,
      "reconstruction_confidence": null,
      "uncertain": null,
      "final_text": "and",
      "provenance": "ocr"
    },
    {
      "word_index": 5,
      "bounding_box": {
        "left": 338,
        "top": 45,
        "width": 74,
        "height": 17
      },
      "ocr_text": "several",
      "ocr_confidence": 96.0,
      "damage_status": "intact",
      "damage_fraction": 0.0,
      "reconstructed_text": null,
      "reconstruction_confidence": null,
      "uncertain": null,
      "final_text": "several",
      "provenance": "ocr"
    },
    {
      "word_index": 6,
      "bounding_box": {
        "left": 421,
        "top": 45,
        "width": 112,
        "height": 17
      },
      "ocr_text": "enclosures",
      "ocr_confidence": 96.0,
      "damage_status": "intact",
      "damage_fraction": 0.0,
      "reconstructed_text": null,
      "reconstruction_confidence": null,
      "uncertain": null,
      "final_text": "enclosures",
      "provenance": "ocr"
    },
    {
      "word_index": 7,
      "bounding_box": {
        "left": 541,
        "top": 45,
        "width": 29,
        "height": 17
      },
      "ocr_text": "fell",
      "ocr_confidence": 96.0,
      "damage_status": "intact",
      "damage_fraction": 0.0,
      "reconstructed_text": null,
      "reconstruction_confidence": null,
      "uncertain": null,
      "final_text": "fell",
      "provenance": "ocr"
    },
    {
      "word_index": 8,
      "bounding_box": {
        "left": 578,
        "top": 45,
        "width": 20,
        "height": 17
      },
      "ocr_text": "to",
      "ocr_confidence": 96.0,
      "damage_status": "intact",
      "damage_fraction": 0.0,
      "reconstructed_text": null,
      "reconstruction_confidence": null,
      "uncertain": null,
      "final_text": "to",
      "provenance": "ocr"
    },
    {
      "word_index": 9,
      "bounding_box": {
        "left": 605,
        "top": 45,
        "width": 32,
        "height": 17
      },
      "ocr_text": "the",
      "ocr_confidence": 96.0,
      "damage_status": "intact",
      "damage_fraction": 0.0,
      "reconstructed_text": null,
      "reconstruction_confidence": null,
      "uncertain": null,
      "final_text": "the",
      "provenance": "ocr"
    },
    {
      "word_index": 10,
      "bounding_box": {
        "left": 645,
        "top": 45,
        "width": 51,
        "height": 17
      },
      "ocr_text": "floor.",
      "ocr_confidence": 96.0,
      "damage_status": "intact",
      "damage_fraction": 0.0,
      "reconstructed_text": null,
      "reconstruction_confidence": null,
      "uncertain": null,
      "final_text": "floor.",
      "provenance": "ocr"
    }
  ],
  "evaluation": {
    "ground_truth_text": "The lawyer unsealed it, and several enclosures fell to the floor.",
    "cer": 0.0308,
    "wer": 0.0909,
    "reconstruction_top1_accuracy": 0.0,
    "content_word_accuracy": 0.0
  }
}